{
  "$schema": "../gem-book/schema.json",
  "title": "Gem",
  "icon": "../../logo.png",
  "i18n": true,
  "homeMode": true,
  "site": "https://gemjs.org",
  "sourceBranch": "docs",
  "docsearch": {
    "appId": "HH69WUYEV1",
    "apiKey": "92e580909316a373f879739621d7075b",
    "indexName": "gemjs"
  }
}
