{
  "$schema": "./schema.json",
  "title": "GemBook",
  "icon": "../../logo.png",
  "i18n": true,
  "homeMode": true,
  "site": "https://book.gemjs.org",
  "sourceBranch": "docs",
  "ga": "G-PZYZ441YD3",
  "port": 8090,
  "global": {
    "hello": "Hello World!"
  },
  "docsearch": {
    "appId": "05KK61XW6A",
    "apiKey": "b6738e2ef6d977e01ab3a325b91937e1",
    "indexName": "book-gemjs"
  }
}
